{
  "$schema": "https://json-schema.org/draft/2020-12/schema",
  "$id": "m5_person_a_review_context_v0_1.schema.json",
  "title": "M5 Person A frozen mathematical review context",
  "type": "object",
  "additionalProperties": false,
  "required": ["schema_version", "context_id", "proof_id", "target", "theorem", "global_assumptions", "domain", "failed_inference", "allowed_evidence", "unrelated_branch_digests", "error_certificate_digest", "patch_digest"],
  "properties": {
    "schema_version": {"const": "0.1"},
    "context_id": {"type": "string", "minLength": 1},
    "proof_id": {"type": "string", "minLength": 1},
    "target": {"type": "object", "additionalProperties": false, "required": ["proof_id", "node_id", "version"], "properties": {"proof_id": {"type": "string", "minLength": 1}, "node_id": {"oneOf": [{"type": "integer", "minimum": 1}, {"type": "string", "minLength": 1}]}, "version": {"type": "integer", "minimum": 1}}},
    "theorem": {"type": "string", "minLength": 1},
    "global_assumptions": {"type": "array", "uniqueItems": true, "items": {"type": "string", "minLength": 1}},
    "domain": {"type": "string", "minLength": 1},
    "failed_inference": {"type": "string", "minLength": 1},
    "allowed_evidence": {"type": "array", "minItems": 1, "uniqueItems": true, "items": {"type": "string", "minLength": 1}},
    "unrelated_branch_digests": {"type": "object", "additionalProperties": {"type": "string", "pattern": "^sha256:[0-9a-f]{64}$"}, "propertyNames": {"minLength": 1}},
    "error_certificate_digest": {"type": "string", "pattern": "^sha256:[0-9a-f]{64}$"},
    "patch_digest": {"type": "string", "pattern": "^sha256:[0-9a-f]{64}$"}
  }
}
