{
  "schema_version": "0.1",
  "context_id": "m5-batch-m2-034-context-r2",
  "proof_id": "m2-034",
  "target": {
    "proof_id": "m2-034",
    "node_id": 2,
    "version": 2
  },
  "theorem": "证明对任意实数 a，都有 sqrt(a^2)=|a|。",
  "global_assumptions": [
    "a 为实数。"
  ],
  "domain": "elementary_algebra",
  "failed_inference": "The current topological node failed independent revalidation.",
  "allowed_evidence": [
    "certificate:m2-034-batch-v0.2-error-r2",
    "batch-ledger:batch-m2-034-036-039-040-041-v0.2"
  ],
  "unrelated_branch_digests": {},
  "error_certificate_digest": "sha256:1752d4795c75b1d98e9c480705335ef3dec69159952e258c74f7b83d0cd97f79",
  "patch_digest": "sha256:dfa757b5393851a20c7f126ef3852159266c5a6132d08b24299f30640991c9a4"
}
