{
  "schema_version": "0.1",
  "context_id": "m5-batch-m2-040-context-r2",
  "proof_id": "m2-040",
  "target": {
    "proof_id": "m2-040",
    "node_id": 3,
    "version": 2
  },
  "theorem": "证明两个偶整数之和为偶数。",
  "global_assumptions": [
    "x,y 为偶整数。"
  ],
  "domain": "elementary_algebra",
  "failed_inference": "The current topological node failed independent revalidation.",
  "allowed_evidence": [
    "certificate:m2-040-batch-v0.2-error-r2",
    "batch-ledger:batch-m2-034-036-039-040-041-v0.2"
  ],
  "unrelated_branch_digests": {},
  "error_certificate_digest": "sha256:2180b4a599708a73632b2b4fef57fb4b1c73c02ae327010cc82f4c8cffa0068e",
  "patch_digest": "sha256:d7029db3b07e7721f9eb17df49370e6a917c6220d8ccd7108e53eacea46fe6e1"
}
