{"schema_version":"0.1","context_id":"m5-provisional-m2-029-person-a-context","proof_id":"m2-029","target":{"proof_id":"m2-029","node_id":2,"version":1},"theorem":"证明若实数 x+y=0，则 x=y=0。","global_assumptions":["x,y 为实数且 x+y=0。"],"domain":"real_numbers","failed_inference":"A zero sum implies y=-x, not that both summands are zero.","allowed_evidence":["certificate:m2-029-m3-false-theorem-node-2-v1","source:m2-029-frozen-theorem-and-proof"],"unrelated_branch_digests":{},"error_certificate_digest":"sha256:beaccaf296a749dfce7eb992ff126727108c13b66373dc729cbd852793adc2b4","patch_digest":"sha256:bff1704e1d72ffd67bca63667bec350e3a5fda2b1f0b5662e42e1cc32fbbd710"}
