{
  "schema_version": "0.1",
  "context_id": "m5-batch-m2-045-context-r1",
  "proof_id": "m2-045",
  "target": {
    "proof_id": "m2-045",
    "node_id": 2,
    "version": 1
  },
  "theorem": "证明若整数 a|b，则 a^2|b^2。",
  "global_assumptions": [
    "a,b 为整数且 a|b。"
  ],
  "domain": "elementary_algebra",
  "failed_inference": "The current topological node failed independent revalidation.",
  "allowed_evidence": [
    "certificate:m2-045-batch-v0.2-error-r1",
    "batch-ledger:batch-m2-044-045-046-047-v0.2"
  ],
  "unrelated_branch_digests": {},
  "error_certificate_digest": "sha256:991188850d7dbe5581e5bd2af22470ef88a4a0e4b37c88d79ab0e3a4bc55ef1a",
  "patch_digest": "sha256:c43ab4834edca8aa6d2b921ec009ad518f47206e6d2d8cdf970986d675822394"
}
